Data,Tipo,Legenda / Tema,Views (Plays),Alcance,Interações,Shares,Visitas Perfil,Likes,Comentários,Salvos,Link do Post,Status/Erro
2025-08-11,FEED,"Eu tinha planos para hoje. Desde que soube que o Frei Gilson estaria em uma cidade tão próxima a minha disse em alto e bom som: “Nós iremos, com toda certeza.” 

Para quem não sabe, muito da transformação que há em mim, assim como a vida da Teresa, nasceu de madrugadas silenciosas, regadas a muitos rosários, e do canto repetido como oração: “Deixa Deus sonhar em ti.” 

Parecia tão justo que eu fosse… 

Mas, este inverno tem sido rigoroso. Hoje, o frio se fez ainda mais presente, e não seria prudente expor a Teresa a tantas pessoas nesse clima. Fiquei triste por um momento, mas logo me lembrei do meu chamado agora. 

Por mais que ir à missa do Frei seja algo bom, meu primeiro chamado não é esse. Meu dever diário é ser mãe de crianças pequenas. Essa é a minha missão. E missão exige renúncias. Muitos “nãos” que às vezes se dirigem a elas, mas que, na maior parte do tempo, se dirigem a mim mesma, e é assim que deve ser. 

Este texto não é uma lamentação, é também não  é sobre a missa. É um lembrete: se você está, como eu, educando crianças pequenas, é exatamente aí que deve estar. Este é o tempo de entrega, de semeadura, e ele é passageiro. Mas se quer um conselho, não viva apenas pelo resultado. Aproveite o processo. A graça da vida está nos pequenos deveres diários. Afinal, “obras é que são amores, não as boas razões”  São Josemaria Escrivá

E você… qual será a “missa” que deixará de ir hoje?",1424,1424,82,2,15,73,6,3,https://www.instagram.com/p/DNPAsNDxKvn/,OK
2025-07-01,FEED,"Depois de um dia cansativo e gelado, tudo o que eu mais queria era um banho quente.

Mas no meio de tantos pingos quentes, um único pingo gelado me tirou o conforto inteiro.

E ele não apareceu ali hoje.
Eu já sabia que estava lá.
Só não parei pra cuidar.

Quantas vezes a gente faz isso com a vida?

Vai empurrando pequenas rachaduras.
Vai ignorando alertas em nome da pressa.
Até que um único pingo… vira o último.

E transborda tudo.

Talvez o seu pingo gelado seja a exaustão.
Ou um silêncio conjugal que te adoece.
Ou o peso da rotina que ninguém vê.
Ou o grito que você não queria dar , de novo.

Por fora, tudo parece bem.
Por dentro… algo desconforta, algo pulsa, algo avisa.

Não espera tudo desabar.
Cuide da sua casa. Da sua C.A.S.A.
Com calma.
Com aliança.
Com sustento.
Com autoridade.

Um pingo pode virar tempestade. Ou o sinal de que é hora de ordenar de dentro pra fora.

Você não precisa esperar transbordar pra começar a cuidar.",1191,1191,53,2,8,44,6,3,https://www.instagram.com/p/DLlgZDWRx_g/,OK
2025-06-23,FEED,"Teresa nasceu no dia 17 de novembro e o batizado foi marcado para um mês depois, porque eu tinha pressa.

Na véspera, quase como um aviso de que os planos não eram meus, minha sobrinha, filha dos padrinhos,precisou fazer uma cirurgia de emergência. O batismo foi cancelado.

Desde então, muitas tentativas de conciliar as agendas… até que nova data: 21 de junho.

Mas a vida… ah, a vida tem seus próprios caminhos.

No dia 5 de junho, internamos a Teresa com bronquiolite. Tudo evoluiu muito rápido… e no dia seguinte ela foi transferida para a UTI.

Entrei na capela do hospital completamente desnorteada. Me ajoelhei e, mais uma vez, só consegui repetir:

“Senhor, se Tu quiser… eu também quero”

Em meio às lágrimas, uma inquietação ecoava dentro de mim:

“Teresa não é batizada.”

No último banco, uma irmã fazia suas orações. Contei a ela sobre a Teresa… ela olhou pro terço nas minhas mãos e perguntou:

“Ela é batizada?”

Em poucos minutos estávamos ao redor da Teresa.
Ali, naquele leito de hospital, com três gotas de água em sua cabecinha… ela foi batizada.

Três gotas. O suficiente.

Em Nome do Pai, do Filho e do Espírito Santo.

Não… não foi como eu tinha sonhado.

Nos meus planos, o batismo seria uma grande celebração.Reuniria as pessoas que tanto intercederam por ela… já tinha escolhido o sabor do bolo, o cardápio, lembrança ..tudo.

Mas como nosso olhar se volta fácil demais para a matéria, né? Para o que é visível… controlável… 
Enquanto Jesus, com Sua paciência e amor, vai sussurrando…E às vezes… muda tudo…

Só pra que a gente aprenda a contemplar o que realmente importa: a eternidade.

Teresa foi batizada em um leito de hospital…
E agora, pela graça de Deus, pudemos confirmar seu batismo.

Entrei na igreja… ela estava completamente vazia.
O padre que tanto intercedeu por ela apareceu vestindo uma casula de rosas 🌹
E nas mãos… uma relíquia de Santa Teresinha.

No simples. No silêncio. No profundo.

Porque, no fim… tudo é graça.
(Santa Teresinha)

Que os nossos desejos tão humanos… tão materiais…não nos distraiam a ponto de esquecermos de voltar os olhos ao que é eterno.

Seja bem-vinda à Igreja de Cristo, minha florzinha.
Minha filha… e agora, filha de Deus",3595,3595,482,0,147,438,29,15,https://www.instagram.com/p/DLQEM9vx7Dq/,OK
2025-06-12,FEED,"De repente, a gente sai de casa como sempre: sendo dois. E volta em uma nova configuração tão bonita quanto desafiadora: sendo três.
Depois quatro. E agora... cinco.
E depois… 

Mas no meio desse milagre,muitas vezes os olhares não se cruzam com a mesma frequência, as mãos não se entrelaçam com tanta naturalidade.
 E as palavras... às vezes, saem duras, machucadas pela pressa, pela privação de sono, pela bagunça ao redor. 

Porque quando a exaustão chega — e ela chega — não é só a paixão que sai. É a memória do “nós”. É a doçura do casal antes da casa cheia.
É nesse momento que me lembro que não faz o menor sentido aquela frase solta por aí: “Engravidou pra segurar o marido.”
Ei.. depois de um filho, você mal segura o xixi. Acha mesmo que vai segurar um casamento? Não! 
 Casamento não se segura. Casamento se cultiva. Todos os dias. Mesmo (e principalmente) nos dias em que o amor parece se esconder atrás da rotina.
E cuidar desse relacionamento é, sim,a  principal parte da educação das nossas filhas. Elas estão aprendendo a amar… ao nos observar.

Às vezes, eu sinto falta do nosso tempo no sofá. Daquela preguiça de domingo, do “só nós dois” sem hora. Das inúmeras viagens que fazíamos..  Sinto falta de bilhetes bobos deixados pela casa,e até daquele abraço demorado no meio da tarde. Sinto falta de ser vista e tantas vezes nem te vejo.. 

Mas em outros dias... eu te vejo.
Te vejo escrevendo uma carta de amor silenciosa quando leva as meninas pra passear  ou para trabalhar com você só pra eu ter um pouco mais de tempo.  Te vejo na mesa, preparando o café. Te vejo contando histórias com vozes engraçadas e caretas que só você sabe fazer. Te vejo vibrando quando uma delas aprende algo novo como se fosse tua pequena vitória também ( e sei que é ) 
Te vejo, independente dos problemas, do cansaço , sentando no chão every single day e brincando com elas.. 

E aí eu lembro… o amor não desapareceu. Ele só mudou de roupa. Ele só se adaptou às novas estações da nossa casa.
Porque antes éramos dois. Nos tornamos um pra viver o milagre de sermos cinco

Partilhar a vida com você é o melhor de Deus para mim.",1872,1872,102,1,13,93,7,2,https://www.instagram.com/p/DK0D3hfx5iy/,OK
2025-06-12,FEED,"*Transcrição

Hoje pela manhã, eu abracei muito e beijei as maiores, enquanto elas me pediam incessantemente para que ficasse com elas. Nos dizem que nasce uma mãe, nasce uma culpa, e às vezes eu me pergunto, por que eu não me culpo tanto assim? Como eu me culparia em uma situação como essa? Eu tenho outra, precisando também de mim. 

Ah, é por isso que não se deve ter tantos filhos? Alguns poderiam pensar, porque não conseguiremos dar atenção, cuidar de todos ao mesmo tempo? De fato, não é possível muitas vezes cuidar de todos ao mesmo tempo, mas a gente cuida de cada um, dando a eles aquilo que é necessário em cada tempo. 

Não, eu não sinto culpa. Não tem por que sentir. Você acha que tem? Quando a vida se apresenta diante de nós e nos pede algo que estejamos prontas para responder. E que essa resposta seja madura, adequada, sem culpa. Porque sabemos que estamos fazendo aquilo que precisamos fazer, que estamos de fato entregando aquilo que nos está sendo pedido para aquele momento. 

Não, eu não sinto culpa. Mas isso não quer dizer que eu não sofra. Sim, é difícil. É difícil deixar duas. É difícil quando eu deixo aqui uma. A vida é sempre sobre difíceis. Ah, não é aqui o lugar do caminho de fácil, não. A porta continua estreita, mas eu ainda sou grande para ela. 

De fato todos os dias eu peço para que Deus me diminua um pouquinho, para que eu consiga passar por ela, é assim que tem que ser, talvez seja isso que Ele esteja fazendo agora, me diminuindo mais um pouquinho, porque de fato nada do que eu disse aqui é sobre mim, eu tenho total certeza e convicção de que tanto a culpa que eu não sinto quanto a percepção do que eu preciso de fato fazer não vem da minha sabedoria, não vem do meu discernimento, mas vem de um lugar de paz que excede  todo o entendimento. 

 Na verdade, eu preciso admitir, o que vem de mim não é tão bom assim.. 

Sim, é  por isso que  Ele  continua me diminuindo. Eu ainda estou grande pra porta",1606,1606,70,1,17,59,9,2,https://www.instagram.com/p/DKzdQsTxPYb/,OK
2025-06-11,FEED,"Deus tem falado comigo há algum tempo por meio da dor.

Não só da minha dor... Mas,  Ele me preparou antes para vivê-la através da dor do outro.

Chorei muito com um testemunho contado em uma aula de formação para terapeutas. Ali, uma mãe, nos ensinando, de uma forma antes nunca vista por mim, como entregar um filho, um bebê de olhos de girassol, ao Senhor.
Não havia nenhuma explicação para o sentido que ela encontrou em sua cruz, se não fosse por Jesus.

Em outra aula, ouvi uma mulher que, ao retornar da apresentação de balé da filha, a poucos metros de casa, sofreu um acidente. E ali, entregou a filha e o marido de volta a Jesus.

Vi mais duas mães que também receberam olhos amendoados, como eu recebi e já não as tem mais nos braços. 

Escrevo em lágrimas, somando as minhas com as delas. 
E tenho convicção de que Deus tem me preparado há um tempo para a dor.

Muitas vezes, disse a Ele:
“Senhor, se Tu puderes, afasta de mim este cálice, mas que seja feita a Tua vontade.”

Peço ao Senhor que, se possível, siga afastando de mim a dor delas. Que as dores tão menores que eu tenho vivido sejam instrumento.
Que eu seja voz para falar da dor.

Que a dor não seja em vão.
Que eu não a conheça da mesma forma que a maioria a conhece,mas que eu encontre sentido nela.
Que eu encontre a minha cruz, e a abrace  como fez  Jesus.

Que eu não a negue. E ao abraçá-la, eu creio: ela se torna mais leve. E Jesus trará ajuda pelo caminho, como encontrou no calvário dEle.

Não era à toa que Simão, o Cireneu, estava lá.
Não foi só para ajudar Jesus a carregar a cruz.
Foi para que nós entendêssemos que precisamos receber do outro e que também somos chamados a ser o outro.

Talvez esse “outro” venha por meio de um texto, simples e despretensioso  mas que, assim como os testemunhos que me forjaram, pode alcançar alguém.
Alguém que mal imagina…mas que também está sendo preparado para viver um calvário.

Eu preciso te contar: um calvário é feito de dor.
Sim, a gente sangra nele. Mas também é feito de entrega, de amor.

E ele aponta para um lugar, um lugar onde não haverá mais dor.
Mas até chegar lá, a gente  entende que vai precisar sofrer — por e pelo AMOR.

E esse Amor…
é Verbo.",5595,5595,285,19,633,247,14,24,https://www.instagram.com/p/DKxPlQZxU-p/,OK
2025-06-10,FEED,"Eu encontrei uma forma de falar com vocês.

Digitar  leva tempo, e muitas vezes minhas mãos estão ocupadas, como agora, enquanto dirijo a caminho do hospital. Mas me contaram que já existe tecnologia capaz de transformar a voz em texto. Saber usá-la pode ser bom.. 

Não, ela não vai substituir minhas palavras, ela não sente, quem  sente sou eu.

A tecnologia pode ser útil em muitas coisas, mas nunca vai substituir o que somos. Somos os únicos criados  à imagem e semelhança de Deus. Somos os únicos que podem... amar, chorar, sofrer … assim como Ele. 

Podemos orar e dizer: “Senhor, se puderes afasta de mim este cálice mas que seja feita a Tua vontade.”

Minhas palavras precisam carregar tudo isso. Tudo o que sinto. Tudo o que às vezes transborda em mim.
Eu preciso falar. Preciso transformar as lágrimas em palavras. Isso me estabiliza ao passo que eu sei, hoje eu sei, que essas palavras alcançarão outros corações. Que talvez não consigam se estabilizar falando, mas conseguem, de fato, encontrar a paz, o equilíbrio, em silêncio, lendo.

 Eu  não sei quem tá aí do outro lado, mas eu ficarei extremamente feliz se um pouco de tudo isso que está em mim aqui chegar em você aí.

Gostou de lágrimas ( ops, palavras) transcritas em quase uma oração?",1704,1704,116,3,41,100,8,8,https://www.instagram.com/p/DKu-zpsxxYA/,OK
2025-06-05,FEED,"Era um daqueles dias em que tudo parecia me chamar ao mesmo tempo.
Uma bebê doente no colo.
Outra se recuperando à frente.
Louça por lavar. Casa por arrumar. Trabalho atrasado.

A ansiedade, por um instante, me tomou pelas mãos.
Mas Deus, com Sua paciência tão firme, me mostrou o caminho de novo:
no simples, no pequeno, no olhar brilhando diante de uma janelinha nova — a primeira janela na boca.

E então me dei conta: ela está crescendo, minha primogênita perdeu o primeiro dente.
Ela, que me ensinou a ser mãe, que me apresentou o maior desafio da maternidade até aqui:
matar meu egoísmo todos os dias e ordenar a minha vida para ser a mãe que ela precisa que eu seja, crescer sabe? Amadurecer...
E com esse segundo plano de desenvolvimento que chega, vem também a faculdade da razão.

Agora, mais do que nunca, preciso ser intencional: na escuta, no exemplo, nas palavras, nas pausas.

A casa limpa é importante, claro. O trabalho que ficou atrasado, também. Mas há dias em que eu não vou governar.
E nesses dias, Aquele que governa tudo me convida a aprender: que o controle nunca foi meu.
Só a entrega pode ser mim. Eita, que difícil que é de fato entregar e se entregar. 

A janelinha que ela me mostrou com tanto orgulho virou, pra mim, uma janela de contemplação.

Ali, entre o que cai e o que nasce, entre o dente que se solta e a mulher que se forma, eu vi um lembrete suave: é no pequeno que Deus ensina o eterno, é na entrega que sigo tentado aprender um pouco mais.

Um pouco, todos os dias…foi só o primeiro",1573,1573,64,1,4,52,6,6,https://www.instagram.com/p/DKhcrUBRD18/,OK
2025-05-27,FEED,"A semana mal tinha começado…
mas dentro de mim, uma já tinha se emendado na outra.
O corpo cansado. A alma apressada.
Uma segunda-feira que já carregava o peso de todas as outras.

Entre a máquina de roupa, a louça esquecida,
uma fralda pra trocar, uma bebê para alimentar,
o relógio que me arrastava pra mais uma ida à escola...

Ísis, com seus três anos de encantamento, entra no carro e solta:

— Mãe… hoje é aniversário da pof Kaline!

— Que legal, filha! Vamos fazer uma cartinha?

— Sim!
(E, com os olhos brilhando, ela completa:)
— E também um bolo, mãe. De milho. Porque ela adola.

Naquela hora, me lembrei do exame marcado bem cedo no dia seguinte.
Do que ficou por fazer.
Das três filhas.
Do jantar.
Da rotina que ainda me esperava inteira.

A resposta escapou automática:

— Filha… hoje mamãe tem muita coisa pra fazer.

A mais velha, com senso prático, oferece um caminho:

— A gente compra o bolo!

Mas Ísis não hesita:

— Comprar não… quero fazer.

E ali, eu quase disse não.
Quase deixei a pressa vencer o gesto.
Mas me lembrei das palavras sobre Santa Zélia, mãe de Teresinha:

“Ela brincava conosco de bom grado,
mesmo que isso significasse prolongar os trabalhos até a meia-noite,
ou mais.”

E eu me perguntei:
O que me custa um bolo?

Uns minutos a mais acordada?
Um cansaço um pouco maior?

Será que não é esse o verdadeiro altar da maternidade?
Abrir mão do controle, para ensinar com o gesto?
Trocar a pressa por presença, a pressa por poesia?

Não era sobre milho.
Era sobre memória.
Sobre aprender, tão cedo, a celebrar o outro.
A ser gentil.
A doar com intenção.

E é assim, sem que percebam, que vão crescendo:
entre bolos feitos com pressa,
entre noites alongadas,
entre mães que escolhem não se poupar,
para não se perderem de si.

A maternidade não exige feitos grandiosos.
Ela pede c.ALMA
Pede olhos atentos ao que parece pequeno —
porque é ali que os valores se plantam.

E toda vez que você escolhe o bem, mesmo cansada…
você prepara a terra onde o coração do seu filho vai florescer.

E você , qual foi seu pequeno sim de ontem ou de hoje?",1828,1828,106,8,11,93,7,6,https://www.instagram.com/p/DKK749qxVAw/,OK
2025-05-11,REELS,"Esse vídeo é uma oração.
Para todas as mães que escolheram tudo — mesmo sem entender tudo.

Se tocou você, compartilha com outra mãe. 💛",2573,2573,166,35,0,145,14,7,https://www.instagram.com/reel/DJgnOQtRwZC/,OK
2025-04-30,REELS,"e que não existe um único caminho, quando uma porta se fecha, Deus nos abre uma janela ou os ouvidos ",2228,2228,140,4,0,128,10,2,https://www.instagram.com/reel/DJFe6LwxaBm/,OK
2025-04-30,FEED,"Talvez você tenha chegado aqui porque está cansada.
Não só fisicamente… mas da bagunça emocional, da culpa constante, das demandas infinitas.

Eu sou Karina Botti, jardineira de três flores.
Uma delas com Síndrome de Down, que me ensina todos os dias a enxergar a vida com olhos mais gratos, mais atentos, e com uma força que eu desconhecia.

Por algum tempo, eu mesma vivi sobrecarregada… tentando fazer tudo com a força do meu braço e me perdendo em meio à desordem da vida:
cansaço físico, desânimo espiritual, brigas no casamento, culpa com os filhos, confusão interna... tudo junto. E ainda querendo fazer o certo.

Mas foi nesse lugar que Deus me achou.
Foi na bagunça que Ele começou a pôr ordem.

E assim encontrei meu chamado.
Eu, que por tantos anos atuei no meio educacional, ocupei cargos, orientei famílias sobre desenvolvimento e comportamento infantil...

Percebi que precisava ir além.
Após um longo período de formação, me tornei terapeuta de mulheres e casais.

Hoje, conduzo outras mulheres a ordenarem a vida para que possam construir a família dos seus sonhos e educar os filhos com intencionalidade. E acredite: 

“Não é o quanto fazemos, mas quanto amor colocamos naquilo que fazemos.
Não é o quanto damos, mas quanto amor colocamos em dar.” - Madre Teresa

Aqui você vai encontrar conteúdo para a alma:
reflexões, pitacos úteis, acolhimento e direção.
Tudo com intencionalidade e verdade.

Se você é uma mulher que quer ser forte no bem, mesmo que às vezes se sinta fraca, esse espaço é pra você.

💛 Karina",2147,2147,200,12,36,178,14,8,https://www.instagram.com/p/DJEwKxGRqbi/,OK
2025-04-28,REELS,"🍯 O fermentado de alho e mel tem propriedades antimicrobianas, desintoxicantes e digestivas. É indicado para:

☑️ Alergias 
☑️Quadros virais e bacterianos 
☑️ aumentar imunidade 

Não use apenas quando apresentar doença.🦠 utilize também para evitá-las 🎯

Passo a passo:

1) Esterilize um vidro com água quente 

2) acrescente o alho 

3) cubra todo o alho com mel 🍯 de preferência cru ( não pasteurizado, você encontra direto do produtor ) 

4) todos os dias da primeira semana abra o vidro  para retirar o excesso de gás que se forma e vire o vidro para misturar os ingredientes 

5) após primeira semana manter o vidro fechado por pelo menos 30 dias ( ideal 3 meses) em um local escuro 

Como usar:

🤓uma colher por semana quando saudáveis 
😷quando doente, 2 colheres por dia 

Compartilhe com outras mães para protegerem os seus neste outono/inverno 🍂 🥶",3391,3391,127,63,0,75,3,49,https://www.instagram.com/reel/DI_i6Gaxf56/,OK
2025-04-15,REELS,acordei ,832,832,89,0,0,82,6,1,https://www.instagram.com/reel/DIduXDaxwAp/,OK
2025-02-25,REELS,"Minha pequena via. Com Santa Teresinha aprendi que o que santifica as almas não é a grandiosidade dos atos, mas a intensidade com que cada ação é praticada. Isso mudou tudo!",2052,2052,97,4,0,90,3,4,https://www.instagram.com/reel/DGhEc6FxQBK/,OK
2025-02-24,FEED,"O domínio da vida cotidiana nos parece escorrer pelos dedos ao segurar nos braços um recém-nascido.
Muitas vezes, temos a sensação de que estamos sendo engolidas e que a vida está passando, e nós, sobrevivendo.

Talvez seja mesmo isso.

Acabo de completar 3 meses com um bebê no colo, meu terceiro puerpério e o mais leve deles.

Sigo refletindo a respeito, afinal, o puerpério mais cheio de desafios que já vivi, entre UCI, diagnósticos, terapias, médicos, médicos... E eu disse médicos? Como pode ser leve?

Pode! E tem sido (o que não quer dizer fácil, ok?). Refletindo sobre isso, cheguei à seguinte conclusão:

Puerpério é morte e vida. Nada nos confronta tanto, nem nos ensina a matar nosso egoísmo de forma tão profunda quanto ter um recém-nascido nos braços. Não lutar contra isso, não resistir, e perceber a oportunidade incrível de crescer, de amadurecer um pouco mais a cada dia... Isso nos leva a um novo patamar: o da entrega.

Jesus entregou Sua vida por nós. A maternidade nos pede o mesmo. Nenhum filho tira nossa vida, mas nós a damos. Damos de nós mesmas, como Ele fez, de forma voluntária, sem hesitar.

Morte e vida. Renúncia e entrega. 

Registro de um dia feliz: finalmente consegui fazer um bolo com as meninas e tomamos café da tarde. Não espere, com um bebê nos braços, a mesma vida de antes. Por que buscar incansavelmente o que já foi, ao invés de se entregar ao melhor que está por vir?

“Faça tudo com Amor, por Amor e para o Amor, esse é o segredo.” Santa Terezinha.",1760,1760,54,0,6,41,4,9,https://www.instagram.com/p/DGeSiJfxBCY/,OK
2025-01-17,REELS,"2 meses da nossa menina milagre. A florzinha que veio perfumar ainda mais nosso jardim. Louvamos a Deus pela sua vida Teresa e por dilatar tanto nosso coração. Te amamos ❤️

#sindromededown #trissomia21",3996,3996,329,5,0,313,13,3,https://www.instagram.com/reel/DE8c4dXRrJB/,OK
2024-12-19,REELS,"“Tu criaste o íntimo do meu ser e me teceste no ventre da minha mãe"" 
“Eu te louvo porque me fizeste de modo assombroso e admirável. As tuas obras são maravilhosas! Sei disso muito bem"" 

Maravilhosa, você é uma obra maravilhosa do Senhor nossa florzinha. 

Você chegou para perfumar ainda mais nosso jardim e dilatar nossos corações 💕",4127,4127,432,10,0,382,47,3,https://www.instagram.com/reel/DDx-k7jR6eL/,OK
2024-12-10,REELS,"Quem se lembra de um story que postei com essa música e escrevi “ Senhor, me dê a graça de ter a Teresa nos braços “ vocês não sabiam mas eu estava em prantos depois do primeiro diagnóstico.. 

Graça alcançada “ And I don’t wanna miss a thing” ❤️",2855,2855,162,1,0,150,7,5,https://www.instagram.com/reel/DDY8KKLRmMX/,OK
2024-12-01,FEED,"A promessa se cumpriu! Aquele que te conhecia antes de forma-lá em meu ventre te preservou minha florzinha. 

Quantas missas participei em lágrimas, muitas de desespero e súplica diante de tantos prognósticos ruins que recebíamos. 

Hoje minhas lágrimas foram de gratidão pela sua vida como ela é, pois Deus não erra! 

Louvado seja Ele pela sua primeira, de muitas missas, porque minha maior missão nessa terra é ensinar a você e suas irmãs a quem vocês devem amar mais… se eu falhar nisso, falharei em tudo.",5287,5287,480,0,438,447,26,7,https://www.instagram.com/p/DDC2jSLx4VF/,OK
2024-11-25,FEED,"Ontem completou uma semana do nosso encontro e quando olho essa foto só consigo me lembrar o quanto pedi a Deus para dilatar meu coração e me fazer fiel.

Ele sabia que eu precisava de você para isso. Você já foi capaz de transformar nossas vidas de uma forma que não consigo descrever.

Um amor que não exige nada que apenas entrega. 

Ah minha Teresa, não há nenhuma condição que seja capaz de me fazer te amar menos… eu já te amo com tudo que há em mim e por mais que não saiba o porquê Deus me escolheu para ser sua mãe eu farei de tudo para não decepciona-lo. 

Seja bem-vinda minha florzinha, você veio para tornar nosso jardim ainda mais perfumado.",4227,4227,404,1,123,374,30,0,https://www.instagram.com/p/DCy-HTGxOP7/,OK
2024-11-08,REELS,Sem legenda,832,832,47,0,0,41,6,0,https://www.instagram.com/reel/DCHLWtPRMnv/,OK
