Data,Tipo,Legenda / Tema,Views (Plays),Alcance,Interações,Shares,Visitas Perfil,Likes,Comentários,Salvos,Link do Post,Status/Erro
2024-11-07,FEED,"“ A santidade não consiste em grandes obras, mas em pequenas coisas feitas com amor” Santa Teresinha 

Quando me tornei mãe vivi o mesmo processo que a grande maioria, me perdi  um pouco de mim. 

Um dos pilares que deixei ruir foi minha espiritualidade. Eu tentava encaixa-la, como a vivia antes,  na minha nova rotina e não conseguia. Eu já não tinha tempo para tanta leitura e nem meditações da Palavra.

Como uma boa colérica imatura, fui deixando de lado afinal, se não consegue fazer o “perfeito” nem faça. 

Pela graça de Deus recebi mais filhas e como tudo, minha espiritualidade precisou ser revista. 

Eu entendi, pela pequena via de Santa Teresinha que eu não precisava de grandes feitos. Entendi também com a sabedoria de Santa Teresa D’Avila que “ Em meio as panelas também anda O Senhor” 

Filhos são a herança do Senhor, eles não são os responsáveis pelo afastamento na fé, nem nos nossos relacionamentos. 

A nossa fé pode crescer entre roupas para dobrar, louça para lavar, um bumbum para limpar desde que nossa intenção se volte para isso, desde que nos esforcemos em estar na presença de Deus.

Nada é pequeno se feito com amor!",2335,2335,53,0,7,49,3,1,https://www.instagram.com/p/DCE75jnx5Fb/,OK
2024-10-06,FEED,"“ Gestar, essa é sua função “ é o que obstetra me diz a cada consulta. Parece simples, não é? Afinal, já gestei duas vezes antes, mas nunca como função principal. 

Nas minhas gestações anteriores eu segui a vida enquanto gestava. Agora, parece até que “parei a vida enquanto gesto”. 

Hoje, passei mais um dia sozinha, deitada, enquanto papai se desdobra em mil para que eu possa cumprir meu repouso. Mas espera, este texto não é apenas sobre mim; é sobre você também.

Parece um sonho, não é? Para uma mãe de três? Talvez seja. Mas a verdade é que sou colérica, eu queria estar ali, pintando as paredes do quarto branco das meninas, que está tão sem graça, ou organizando cada detalhe do ninho para a chegada da nossa florzinha.

É isso que nos consome! Sempre ansiamos por algo além do que a realidade nos oferece. Como é difícil cumprir o ensinamento de Josemaria: “Faz o que deves e está no que fazes.”

Imagine como seria nossa vida se pudéssemos silenciar a mente enquanto lavamos a louça, fazendo isso com amor, em vez de aversão.Imagine  como seria estar com nossos filhos sem pensar no trabalho,  no almoço? Estando ali, sendo presença! 

Imagine sentar-se com nosso marido, desejando ouvi-lo de verdade, buscando conhecê-lo mais profundamente, apesar de todas as demandas e queixas do dia a dia.

Conseguiu imaginar? O que a realidade está te pedindo agora? Ei, Deus fala através dela. Aceite-a com amor e devoção.

Meu coração tem sido moldado por Deus. Como é desafiador aquietar minha alma e meu corpo, permitir que o outro faça, mesmo que de forma diferente — e, muitas vezes, mais devagar. Colérica, lembra?

E como Deus tem tratado o seu coração? Lembre-se: o extraordinário se revela no ordinário, naquilo para o qual você foi chamada. Cumpra o pequeno dever de cada momento, com o coração aberto.

“Fazei tudo por Amor. Assim não há coisas pequenas: tudo é grande. A perseverança nas pequenas coisas, por Amor, é heroísmo.” (Caminho, 813)

Não há nada pequeno! Nada. Coloque todo o seu amor. Gaste-se, porque quem se poupa, se perde.",2556,2556,149,1,27,141,7,1,https://www.instagram.com/p/DAzSvKhRV3g/,OK
2024-10-05,FEED,"Eu não sei quantas vezes me ajoelhei diante do Senhor, clamando a Ele por um milagre. Não sei quantas vezes chorei, e muito menos quantas vezes duvidei.
De fato, não sei, porque não se trata de mim; nunca foi. É sobre Ele e o que Ele escolheu realizar por meio de mim, e sobre o milagre que eu gero, apesar de mim.

Depois de tantas vezes em que chorei diante de um novo diagnóstico, hoje derramei muitas lágrimas ao testemunhar mais uma vez o poder de Deus na vida da nossa Teresa e nas nossas
.
Teresa apresentava, há muitas semanas, resistência nas artérias cerebral média, umbilical, no ducto venoso, e eu nas artérias uterinas. Essas alterações eram preocupantes, e o risco de sofrimento fetal e um parto com prematuridade extrema nos assustava.

Meu último pedido foi pela intercessão de Santa Teresinha. No primeiro dia da sua novena, pedi que houvesse cura nas artérias e que Teresa saísse do risco de prematuridade mesmo ouvindo dos médicos que isso não teria como acontecer, poderia não piorar, agora normalizar não. 

Eu recebi uma rosa, e o sinal do céu fez meu coração se acalmar.

Hoje, tudo se confirmou. Não há mais nenhuma alteração nas artérias, nenhuma! Todos os médicos, mais uma vez, nos disseram: “A ciência não explica o que temos visto com a Teresa.”

A ciência nunca explicará o inexplicável. Por mais que nos esforcemos, ninguém jamais conseguirá explicar a Deus.

Obrigada, Jesus por mais essa graça. Obrigada por toda transformação que há em mim.",2252,2252,145,5,18,127,18,0,https://www.instagram.com/p/DAveF_fxzZy/,OK
2024-10-01,FEED,"Eu nunca fui devota de Santos, mesmo sendo católica desde sempre eu não vivia verdadeiramente a minha fé e sua doutrina como deveria  até que um dia, ao perdermos um primo e nos reunirmos diariamente em oração por sua alma e familiares eu ouvi “ Kaka, a relíquia de Santa Teresinha está aqui, você já viu? “ 

Parei na frente dela com um deslumbre diferente. Eu já havia estado na frente de muitas relíquias mas aquele momento foi diferente mesmo porque eu já tinha me interessado por Teresinha antes. 

Sai de lá querendo saber mais sobre ela. Fiz um curso do padre Paulo Ricardo e ver aquele homem tão forte e tão sábio se derramar em lágrimas por falar de uma menina tão jovem me despertou ainda mais.

Eu não a escolhi. Ela me escolheu. 

Desde então comprei livros, fiz cursos e os ensinamentos dela, uma Santa que viveu apenas 24 anos ressoavam em mim. “ A santidade não consiste em grandes obras, mas em pequenas coisas feitas com amor” essa frase motivou muito minhas decisões somada com “ eu aceito com gratidão os espinhos que estão misturados com as flores “

Me encantei por Santa Teresinha e minha devoção a ela caminhou junto com meu processo de conversão. 

Quando decidimos o nome da Teresa, ela se chamou Helena por uns 3 dias. 

A cada vez que escutava Helena, por mais lindo que achasse o nome algo me incomodava. Rezei a nossa Senhora e pedi que ela escolhesse o nome. TERESA me veio tão forte ao coração e mandei mensagem ao meu marido certa de que ele jamais aceitaria.

“ Amor, Teresa, precisa ser Teresa” ele se surpreendeu e falou da onde eu havia tirado essa ideia, ela  ja a chamava de Helena mas surpreendentemente me disse, se quer Teresa, será. 

Hoje eu consigo entender o porquê ela precisava desse nome e o porquê Santa Teresinha me escolheu para amá-la e ser minha intercessora no céu. 

Santa Teresinha, assim como minha Teresa, apontam para Jesus e nos levam a querer tudo, a aceitar tudo enquanto nosso coração se dilata de uma forma antes desconhecida. 

Santa Teresinha, continue passando seu céu fazendo o bem na terra e olhando por nós.

A vida de nossa Teresa sempre apontará para a sua e por tudo que realizou em nós. Obrigada 🙏🏻",2392,2392,135,0,35,119,10,6,https://www.instagram.com/p/DAlYVH0RwI7/,OK
2024-09-15,FEED,"Com o Rosário na mão chegamos às esperadas 28 semanas, por graça, imensa graça. 

Poderia eu me questionar o porquê o Senhor permitiu que minha terceira gestação, definida por Ele, fosse tão cheia de turbulências. 

Poderia reclamar de viver uma gestação de alto risco, do medo que sinto em cada novo diagnóstico, do esforço em repousar tendo também 2 crianças pequenas. 

Eu poderia me perguntar o porquê comigo mas neste momento me lembro, por que não comigo? Me recordo também de Santa Teresinha, que entendeu de Deus. que aquele que é mais amado recebe as maiores cruzes.

Recebi uma cruz e com ela a oportunidade de transformar minha dor em amor. Afinal, Deus não permitiria o mal se não pudesse tirar desse mal, um bem infinitamente maior como nos ensinou Santo Agostinho. 

E eu vejo, diariamente o bem. Vejo minha fé sendo forjada, vejo um exército de pessoas se unindo a nós em oração, vejo conversões, vejo milagres, vejo um grande testemunho, que impactará muitos, sendo gerado. 

Eu vejo Deus. 

Eu tenho vida em mim. Uma vida que luta e insiste em ficar, que superou todos os diagnósticos, para honra e glória de Deus. Minha pequena e tão grande Teresa, nossa menina milagre. 

Como poderia reclamar? Eu só posso Te louvar Senhor.",3206,3206,311,3,264,274,34,3,https://www.instagram.com/p/C_9A1QQRnB-/,OK
2024-08-11,FEED,"Não, a foto principal não será dele com as crianças, mas será a foto que trouxe a ele a graça de celebrar hoje o Dia dos Pais.

Foi neste momento que tudo começou. Hoje fiquei reflexiva durante todo o dia e me lembrei de que a escolha mais importante que eu poderia fazer na vida não foi e nunca será sobre minha carreira ou algo de natureza material.

A minha melhor escolha foi proclamar, na porta de entrada da igreja, que eu e minha casa serviríamos ao Senhor, e a segunda foi a escolha de quem me esperava no altar.

Você foi e continuará sendo a minha melhor escolha. Sem dúvida, a escolha mais importante foi de quem seria o pai das minhas filhas, nossas filhas.

Você é o melhor pai para cada uma delas. E a cada alma que recebemos, nos aprimoramos, nos entregamos e entendemos que elas são como flechas que serão por nós lapidadas, protegidas e, somente em momento oportuno, lançadas.

“Os filhos nascidos na nossa juventude são como flechas nas mãos de um guerreiro. Feliz o homem que tem muitas dessas flechas!”

Você já tem 3 delas para amar, proteger e direcionar ao que mais importa: ao céu!

De todos os seus papéis, observar você sendo pai é o que mais me enche de orgulho.

Feliz todos os dias! Porque nosso extraordinário está no ordinário da nossa missão diária e partilhar a vida com você, com tudo que lhe pertence, tem sido incrível . Te amamos meu bem @diegogaviao_",3076,3076,122,0,34,117,4,1,https://www.instagram.com/p/C-iyUzjxReB/,OK
2024-07-07,FEED,"TERESA,  nossa florzinha amada. Assim como aquela que inspirou seu nome, Santa Teresinha, você aponta para Jesus e nos leva a querer tudo, a aceitar tudo enquanto, olhando para Ele, confiamos. 

Nossa Senhora te sorriu meu amor, assim como sorriu para ela e desde que soube da sua vida em mim eu soube também  que Deus sonharia Seus sonhos através de você. 

Ah, um dia todos saberão o quão amada és e o quanto sua vida já modificou tantas outras. 

Te amamos!",8067,8067,443,0,1421,415,22,6,https://www.instagram.com/p/C9ICRGURK0b/,OK
2024-06-17,REELS,alegria da mãe que atendeu por mais  de 1 hora…. ,2630,2630,38,0,0,34,4,0,https://www.instagram.com/reel/C8U3xssRTKZ/,OK
2024-04-01,FEED,"Deus nos agraciou mais uma vez, bendito seja Ele! Recebemos mais um bebê, uma alma e estamos constrangidos com seu amor infinito. O Senhor é bom e não se deixa vencer em generosidade. 

Recebo mais uma oportunidade de sair de mim mesma, de servi-Lo vivendo a maternidade. Faça-me fiel Senhor.

@diegogaviao_ seremos pais de novo 🥰. O nosso amor transbordando ao receber o toque de Deus. Obrigada por partilhar a vida comigo e por brilhar os olhos tanto quanto eu diante deste milagre.",6525,6525,479,3,371,413,62,4,https://www.instagram.com/p/C5Ns199uQKp/,OK
2023-08-13,FEED,"Não, ele não sabe exatamente onde encontrar as roupas das meninas, muito menos o que precisa ser reposto.

Ele também não presta atenção nos lanches intermediários, a menos que seja lembrado sobre eles, e isso muitas vezes me irrita profundamente.

Mas sabe, não é apenas isso que eu vejo.

Eu o vejo diariamente pagando um preço alto pela vida que escolhemos viver para que pudéssemos vê-las crescer, para que eu esteja disponível para elas e para que possamos nos sentar juntos à mesa em 99% das refeições. 

Também o vejo com toda coragem para mudar o rumo se necessário, se sacrificando por nós. 

Eu o vejo chegando todos os dias, eu disse todos, independentemente do que aconteça, e se sentando no chão para brincar com as duas.

Eu o vejo se desconstruindo e buscando fazer o que não é tão natural assim: educá-las com respeito.

Eu o vejo errando com elas (assim como eu) e se desculpando por seus erros.

Eu o vejo dando banho, trocando fraldas, levando para o balé e se esforçando para fazer tranças.

Eu o vejo indo muito além de um título, eu o vejo cumprindo lindamente a missão concedida por Deus a ele.

Eu o vejo criando um relacionamento tão lindo e recebendo o que é mais valioso: ele já tem o coração delas simplesmente porque merece tê-lo e ele conquista o meu diariamente pelo mesmo motivo é porque eu decidi olhar para ele dessa forma. 

Feliz todos os dias para você, papai @diegogaviao_ . Você é o nosso porto.",3006,3006,152,0,12,146,4,2,https://www.instagram.com/p/Cv517EFxPZQ/,OK
2023-07-03,FEED,"Hoje é um dia especial, o dia dele! Meu bem, parabéns!Louvo  a Deus por sua vida e por  ter colocado-o na minha.

Ontem, a Helo disse que ela é o seu presente, mas permita-me dizer hoje que você é o nosso!

É um privilégio acordar todas as manhãs ao seu lado, contemplar o que poucos enxergam e agradecer incessantemente por quem você é. Sua dedicação à nossa família é algo que admiro profundamente, pois você sempre a coloca em primeiro lugar, sem hesitação.

Desde o momento em que nos conhecemos, há tantos anos, meu coração se apaixonou pelo homem maravilhoso que você era. E a cada novo dia, meu amor por você se intensifica, pois admiro homem incrível que você se tornou. E saiba que esse amor só cresce, hoje te amo mais que ontem e ainda não amo tudo. 

Você é aquele que me traz calmaria em meio ao caos, que não importa o quão difícil as coisas estejam, no seu abraço encontro paz. 

Acredita em mim mais do que eu mesma, e seu apoio incondicional é meu porto seguro, mesmo quando me proponho a desafios que exigem longas noites de trabalho e fins de semana dedicados. Você nunca cobra nada disso.

Você é o pai mais extraordinário que nossas filhas poderiam ter. Aquele que, independentemente dos acontecimentos do dia, se senta no chão e brinca com elas. Aquele que tenta ser o pai severo, mas cujo coração está repleto de preocupação e cuidado, assim como o meu, pela construção de um relacionamento sólido. Aquele que se as meninas se ausentam por 1 hora já quer saber quando vão voltar porque quer ficar com elas. 

Obrigada, meu amor. Minha promessa a você é feita diariamente: onde quer que você vá, contigo também irei aqui nessa terra e até o nosso lugar .. porque você sabe eu te prometi o céu  por vontade própria ou empurrado mesmo 😅( colérica ela) 

Te amo, te admiro e te respeito. 

Feliz 41 anos com cara e cabelos de 20 ❤️ @diegogaviao_",2009,2009,105,0,3,102,3,0,https://www.instagram.com/p/CuPtARoxZT_/,OK
2023-05-14,FEED,"Hoje o dia das mães começou como mais um dia absolutamente ordinário.

As 7:40 da manhã todos prontos para ir à missa, eu até suspirei, era um milagre acontecendo diante dos olhos, estávamos 20 minutos adiantados até que…

Ísis fez coco, banho de novo! Helo se irritou com a meia calça pinicando..vamos trocar.. corri tanto, chegamos na igreja  08:10.. já tinha perdido  10  minutos da missa. Respirei, ok.. 10 minutos foram  mas nos restam 50 deles.. 

Isso para mim resume ( a grosso modo) a maternidade, nós podemos escolher para onde olhar. Podemos perceber o extraordinário em meio ao ordinário.

Ontem, uma das minhas mentoradas trouxe um texto com uma frase de destaque dita por mim “ não inclua seus filhos na sua lista de afazeres” não automatize e digo mais, não  permita que a bandeira da carga mental, maternidade real e  pesada roube de você o olhar para a graça! A graça de ser mãe.

Afinal, a  maternidade pode ser um  antídoto perfeito para nosso egoísmo. Com ela aprendemos que somos capazes de caminhar mais uma milha quando achávamos que já tínhamos entregado tudo, com ela somos capazes de amar, de nos entregar, de nos doar sem esperar nada em troca ( e é assim que deve ser) 

Com ela podemos aprender o que minha amiga Adriele brilhantemente escreveu ontem “ o fácil e o difícil coexistem”. Se permita romantizar sim sua maternidade , se permita enxergar  o belo em meio ao caos e ouse dar mais ênfase ao bom.. o que  você coloca foco, se destaca. 

Se permita contemplar. Olhe hoje para seus filhos assim como olhei para as minhas hoje na igreja e as lágrimas não paravam de rolar. Pouco importou tudo que aconteceu antes para que pudéssemos estar ali. Eu olho para elas e contemplo o extraordinário 

Porque ser mãe é todos os dias extraordinário. É ser cocriadora do que há de mais precioso: outro ser humano, outra alma humana, não há nada de mais grandioso e belo que isso, não há. 

Feliz dia das mães!",1410,1410,108,0,0,104,3,1,https://www.instagram.com/p/CsPDav5xhfW/,OK
2023-04-16,REELS,"e isso nos frusta, eu sei … ",91,91,22,1,0,21,1,0,https://www.instagram.com/reel/CrG8h7rNe48/,OK
2023-01-08,REELS,mas desde as 5 ela não deixa ,56,56,22,0,0,22,0,0,https://www.instagram.com/reel/CnJr-UkO05o/,OK
2022-09-29,FEED,"Uma amiga querida sempre me disse “ deveríamos começar pelo segundo filho” e hoje posso dizer que a compreendo em uma profundidade antes desconhecida.

Ah o segundo filho traz leveza e urgência. Seria isso paradoxal? Veremos 

A leveza vem da certeza de que tudo, tudo é passageiro. As noites em claro, o babyblues, a anulação temporária de quem se é ( ou de quem se era) e a urgência ?  Ah , ela vem da mesma fonte.

A urgência agora não é para que o terceiro mês chegue, o bebê sente, a noite prolongue. A minha alma hoje grita pela urgência de se viver o agora porque hoje a certeza de que tudo é passageiro se faz presente em mim.

Eu tenho urgência por viver cada detalhe, por tentar congelar cada momento. Escrevo em lágrimas pois fecho os olhos e ainda posso me lembrar de mim grávida da primogênita. Pisco mais uma vez e lembro dela bebê. Das nossas sonecas, das noites em claro que tanta sabedoria me trouxeram. 

Abro os olhos e já contemplo uma menina falante tão grande que nem parece ter saído de mim.

Corro os olhos para a pequena, ah ela já não é tão pequena assim. Já é um bebê grande. 
 
Que alegria e que dor. Será que somente eu vivo tal dualidade ? Madrugadas são tão longas mas os dias, meses e anos dos nossos filhos tão curtas. 

É urgente me entregar ao processo. 

Maternidade para mim sempre foi um processo de cura e hoje, um caminho de santificação. 

Sim, ela exige, é exaustiva mas eu a vejo com os olhos que escolhi: Deus, obrigada por me permitir maternar, não só a elas, mas a mim através delas.",1324,1324,155,0,2,136,9,10,https://www.instagram.com/p/CjGa4FGOYC-/,OK
2022-07-04,FEED,"Há 13 anos comemoramos juntos seu aniversário. Eu vi você trintar, foi uma loucura para chegar a tempo naquele dia em que namorávamos com 689km nos separando mas, na verdade, nada nos separava. 

Você  costuma dizer que me escolheu desde o primeiro dia mas, de fato ,nós fomos escolhidos por Ele.

Eu vi muito mais do que você trintando ou quarentando neste tempo todo. Eu vi você sendo sempre tão corajoso, forte , audacioso. Eu vi você nos guiar e segui cumprindo minha promessa a você “ por onde fores eu irei, onde repousares, repousarei”. Sim, eu sempre pude cumpri-la porque  sempre me senti segura ao seu lado. 

Eu vi você se tornar pai e isso modificou completamente nossos papéis e hoje sermos pais é nosso lugar de destaque. 

E como pais de crianças pequenas às vezes ( muitas vezes) falta tempo. Falta tempo para ser dois quando já se é quatro. 

A vida embola sabe? Mas, por mais embolada que seja eu ainda consigo ver você. 

Ainda vejo o homem que consegue ter leveza em meio ao caos, que o mundo pode estar caindo mas que deita no chão todos os dias, eu disse todos os dias, e brinca com as crianças. 

Consigo ver você se reiventando com uma coragem que é para poucos e já consigo ver também cada fruto que colherá do seu esforço. Viverá voos ainda mais altos do que já viveu. 

E nós, seguiremos assim, como o olhar das meninas para você. Olhar de quem honra, admira e se alegra. 

Eu te amo meu bem. Mais do que ontem e menos do que amanhã. 

Vamos juntos rumo aos cinquenta agora porque minha vida será para sempre ao seu lado.",1351,1351,151,0,4,140,8,3,https://www.instagram.com/p/CflOoHqOkyt/,OK
2022-06-05,FEED,"A maternidade é um caminho solitário, sobretudo, para aquelas que decidem vive-la integralmente.

Seus dias são todos iguais, as demandas da casa e das crianças parecem não ter fim, e na verdade, não tem mesmo. 

Você mal se lembra o dia da semana e para manter seu autocuidado necessita fazer um esforço enorme porque o autoabandono bate a porta e insiste em ficar.

É preciso se lembrar que você também importa. 

Além dos dias, as madrugadas se tornam particularmente solitárias.

Olho pela janela e parece que todos no mundo dormem mas sei que,  na verdade, há em algum lugar outra mãe embalando sua cria. 

O sono queima os olhos e olhar no relógio pode ser sua pior ação. Ao olhá-lo você conta a quanto tempo que está acordada e o quanto lhe resta, com muita sorte, dormir. 

No outro dia uma ou mais ( e quando se tem outra isso se torna particularmente desafiador ) criança te espera. 

Sim eu canso, às vezes choro. Mas ei, este lugar não é novo para mim. Essa não é a primeira criança que embalo. Ufa,  me lembro qhe é passageiro. 

Mas e enquanto não passa? 

Deus, olha eu aqui de novo. Ando tão sem tempo durante o dia que estar aqui no silêncio da madrugada pode ser um grande presente. Vamos conversar?",1001,1001,53,1,1,51,1,1,https://www.instagram.com/p/Ceb4X7WOjNA/,OK
2022-04-28,REELS,Café com terapia hoje ,47,47,5,0,0,5,0,0,https://www.instagram.com/reel/Cc5HxKNg4B0/,OK
2022-04-07,FEED,"S.I.L.Ê.N.C.I.O 

Privação, voluntária ou não, de falar, de publicar, de escrever, de pronunciar qualquer palavra ou som, de manifestar os próprios pensamentos.

Há tempo para tudo debaixo do céu, tempo de falar e tempo de calar.

Minha necessidade de silêncio chegou como brisa suave, fui aos poucos me afastando daqui, atendendo-a. Quando percebi, já não encontrava meios de voltar.

A brisa tornou-se tempestade e estou imersa em um processo que precisa ser atentamente e inteiramente vivido.

Por quê? Ainda não sei, mas me acalma o fato de que “Jesus retirava-se para lugares solitários e orava” Lucas 5:16.

Lugares solitários não são confortáveis, nos tiram do eixo, nos viram e reviram. Neles muitas vezes somos convidados a abrir mão (temporariamente ou não) de sonhos. Lugares solitários questionam: será cedo para desistir?

Silêncio.

Enquanto não há resposta, melhor calar. Melhor recalcular.

Melhor ouvir.

Jesus, eu disse, Jesus precisava de pausa, de silêncio e precisava orar.

Não seria demasiada presunção supor que podemos sempre viver sem interrupção? Sem silenciar?

Eu sigo introspectiva, calada (nem parece combinar comigo, não é?). Sim, haverá muito para dizer deste grande convite recebido de voltar-me para mim, para os meus, embora nem tudo será dito. Nem tudo precisa ser dito.

Eu estou em processo e, como sempre, sigo confiando nele 🙌🏻

Obs: Obrigada por tantas mensagens carinhosas durante meu silêncio.",552,552,113,0,0,88,20,5,https://www.instagram.com/p/CcDuOcnOmql/,OK
2022-03-15,REELS,Só aqui é assim??,44,44,48,0,0,44,3,1,https://www.instagram.com/reel/CbHqN9ClhBG/,OK
2022-02-16,REELS,trabalhar tem sido um grande desafio por aqui com as duas… ,42,42,7,0,0,7,0,0,https://www.instagram.com/reel/CaDFz93FtLK/,OK
2022-01-26,REELS,"Aula 2 do Espalhe-se preparada com sucesso!! 

NESTA AULA VOCÊ VAI...

🌹Entender como as suas crenças impactam a sua maneira de viver e maternar. 
🌹Aprenderá o primeiro grande passo para identificar seus gatilhos 
🌹Entenderá de onde vem seu medo de errar e sua sensação de nunca dar conta de tudo 
🌹Aprenderá 3 passos importantes para avançar em direção à uma vida mais leve e possível

Vamos juntas? ❤️",44,44,30,0,0,26,2,2,https://www.instagram.com/reel/CZM2H8fFnNB/,OK
2022-01-25,REELS,"É hoje!!!! Segunda turma do curso gratuito Espalhe-se!!! 

Eu tô pronta! E você?? 

Te espero hoje às 20:24 ❤️",786,786,30,0,0,30,0,0,https://www.instagram.com/reel/CZJ0n2UlnUN/,OK
